{
  "$id": "lena_video_generation_plan_v1.schema.json", "$schema": "https://json-schema.org/draft/2020-12/schema", "type": "object", "additionalProperties": false,
  "required": ["schema_version", "artifact_type", "artifact_id", "property_id", "video_id", "governed_date", "created_at", "generator_version", "upstream_artifacts", "validation_status", "character_element_requirement", "duration_ms", "resolution", "aspect_ratio", "action_timeline", "camera_requirements", "environment_requirements", "wardrobe_requirements", "sound_requirements", "cost_ceiling_credits", "attempt_authority", "expected_output", "qa_requirements", "execution_authorized"],
  "properties": {
    "schema_version": {"const": "lena_video_artifact_v1"}, "artifact_type": {"const": "lena_video_generation_plan_v1"}, "artifact_id": {"$ref": "common_defs_v1.schema.json#/$defs/artifact_id"}, "property_id": {"const": "lena"}, "video_id": {"$ref": "common_defs_v1.schema.json#/$defs/video_id"}, "governed_date": {"$ref": "common_defs_v1.schema.json#/$defs/governed_date"}, "created_at": {"$ref": "common_defs_v1.schema.json#/$defs/created_at"}, "generator_version": {"const": "lena_video_plan_compiler_v1"}, "upstream_artifacts": {"type": "array", "items": {"$ref": "common_defs_v1.schema.json#/$defs/upstream_artifact"}, "minItems": 9, "maxItems": 9, "uniqueItems": true},
    "validation_status": {"const": "validated"}, "character_element_requirement": {"type": "object", "additionalProperties": false, "required": ["uuid", "token", "direct_binding_required"], "properties": {"uuid": {"const": "6a842337-ef20-4cb9-a0ff-04fa5eb8f8d3"}, "token": {"const": "@[Lena](6a842337-ef20-4cb9-a0ff-04fa5eb8f8d3)"}, "direct_binding_required": {"const": true}}}, "duration_ms": {"const": 8000}, "resolution": {"const": "720p"}, "aspect_ratio": {"const": "9:16"}, "action_timeline": {"type": "array", "items": {"$ref": "common_defs_v1.schema.json#/$defs/timeline_segment"}, "minItems": 4, "maxItems": 4}, "camera_requirements": {"$ref": "common_defs_v1.schema.json#/$defs/string_list"}, "environment_requirements": {"$ref": "common_defs_v1.schema.json#/$defs/string_list"}, "wardrobe_requirements": {"$ref": "common_defs_v1.schema.json#/$defs/string_list"}, "sound_requirements": {"$ref": "common_defs_v1.schema.json#/$defs/string_list"}, "cost_ceiling_credits": {"const": 36}, "attempt_authority": {"$ref": "common_defs_v1.schema.json#/$defs/attempt_authority"}, "expected_output": {"$ref": "common_defs_v1.schema.json#/$defs/nonempty_string"}, "qa_requirements": {"$ref": "common_defs_v1.schema.json#/$defs/string_list"}, "execution_authorized": {"const": false}
  }
}
