{
  "action_timeline": [
    {
      "action": "The rocket clears the distant horizon; Lena tracks it immediately, releases the held breath, and her eyebrows lift before her smile begins.",
      "blink_count": 1,
      "body_movement": "Her chin rises about five degrees and her upper torso inclines forward without locking her knees.",
      "breathing": "held inhale releases into a quiet, visible exhale",
      "camera_relationship": "she remains primarily launch-focused while her profile and both eyes stay readable to the companion camera",
      "end_ms": 2000,
      "expression": "focused_anticipation",
      "gaze_target": "the distant ascending rocket beyond camera-left",
      "gesture_completion": "right hand separates naturally from her leg",
      "gesture_initiation": "right fingers uncurl beside her thigh as recognition begins",
      "meaningful_displacement_cm": 3,
      "provider_prompt_cue": "Rocket clears the far horizon. Lena releases a held breath; brows lift before her smile, chin rises five degrees and torso shifts three centimeters forward. Gaze tracks rocket camera-left; one blink, weight moves to forefeet, right fingers uncurl and hand clears thigh, then shoulders recover loose.",
      "recovery": "shoulders remain relaxed after the initial startle",
      "start_ms": 0,
      "weight_transfer": "balanced stance shifts subtly toward the balls of both feet"
    },
    {
      "action": "Recognition becomes delight; Lena takes one short half-step toward the view and turns her shoulders just enough to share the moment with the person filming.",
      "blink_count": 1,
      "body_movement": "Her left foot advances twelve centimeters, hips follow, and her torso rotates about fifteen degrees toward the phone.",
      "breathing": "easy inhale accompanies the smile without a gasping loop",
      "camera_relationship": "her quick shared glance acknowledges the camera operator without turning the shot into a pose",
      "end_ms": 4000,
      "expression": "open_delight",
      "gaze_target": "briefly the companion behind the smartphone, then back to the rocket",
      "gesture_completion": "forearm reaches chest height with the wrist still relaxed",
      "gesture_initiation": "right elbow bends and forearm begins to lift toward the launch path",
      "meaningful_displacement_cm": 12,
      "provider_prompt_cue": "Delight opens. Lena takes one twelve-centimeter half-step, transfers weight right-to-left, and turns shoulders fifteen degrees toward the phone. After one blink she gives the companion a quick glance, returns gaze to rocket, inhales easily, and lifts her relaxed right forearm to chest height before settling.",
      "recovery": "the torso settles over the new stance instead of continuing to drift",
      "start_ms": 2000,
      "weight_transfer": "weight transfers from right foot to the planted left foot"
    },
    {
      "action": "Lena completes one clear pointing gesture toward the climbing rocket, follows its path with her eyes, and lets delight broaden into genuine awe.",
      "blink_count": 0,
      "body_movement": "Her right forearm extends on a shallow diagonal while her head and sternum rise with the rocket; the left hand stays loose.",
      "breathing": "a natural exhale softens the jaw as the gesture reaches full extension",
      "camera_relationship": "the gesture leads the viewer from Lena to the distant rocket while her face remains unobstructed",
      "end_ms": 6000,
      "expression": "bright_awe",
      "gaze_target": "the small bright rocket and expanding distant plume",
      "gesture_completion": "the pointing line becomes fully readable, holds briefly, then the index finger relaxes",
      "gesture_initiation": "right index finger extends only as the forearm approaches the target line",
      "meaningful_displacement_cm": 15,
      "provider_prompt_cue": "Delight becomes bright awe. Grounded on left foot with no blink, Lena raises chin and sternum, extends right forearm fifteen centimeters and completes one readable point; index finger extends only at target, holds briefly, then relaxes as elbow softens. Her face stays clear; left hand remains loose.",
      "recovery": "right elbow begins to soften before the beat ends",
      "start_ms": 4000,
      "weight_transfer": "weight remains grounded over the left foot with the right heel light"
    },
    {
      "action": "Lena lowers her hand, settles her stance, and watches the successful climb with a quieter open smile and one final amazed glance toward her companion.",
      "blink_count": 1,
      "body_movement": "Her right arm returns to her side, shoulders lower, and her torso eases back to a stable upright position.",
      "breathing": "one calm recovery inhale keeps the chest and shoulders physically alive",
      "camera_relationship": "the closing glance includes the camera operator in the shared awe while the launch remains the visual context",
      "end_ms": 8000,
      "expression": "settled_wonder",
      "gaze_target": "the rocket first, then a final half-second glance toward the companion",
      "gesture_completion": "right hand reaches a relaxed neutral position beside the shorts",
      "gesture_initiation": "right elbow folds to begin the return from the completed point",
      "meaningful_displacement_cm": 5,
      "provider_prompt_cue": "Lena lowers the completed point five centimeters to her side, redistributes weight evenly, drops shoulders, and returns upright with one blink and calm recovery inhale. She watches the safe climb with settled wonder, then gives her companion a final half-second glance; motion resolves without a frozen grin or repeat.",
      "recovery": "movement resolves cleanly with no frozen end-frame grin or repeated gesture",
      "start_ms": 6000,
      "weight_transfer": "weight redistributes evenly across both feet"
    }
  ],
  "artifact_id": "lena_video_2026_08_03_spacex_launch_001_generation_plan_v1",
  "artifact_type": "lena_video_generation_plan_v1",
  "aspect_ratio": "9:16",
  "attempt_authority": {
    "authorized_attempts": 0,
    "credit_ceiling_applies_to_all_attempts": true,
    "retry_authorized": false,
    "separate_authorization_required": true
  },
  "camera_requirements": [
    "simulate a real companion-held vertical smartphone shot rather than a selfie, tripod, drone, crane, or impossible orbit",
    "use only subtle two-handed handheld drift and one small reframe that follows Lena's completed pointing gesture",
    "preserve face visibility, full gesture readability, launch context, caption-safe areas, and twelve-percent headroom",
    "maintain coherent focus, exposure, lens perspective, subject scale, and distant background scale for all eight seconds"
  ],
  "character_element_requirement": {
    "direct_binding_required": true,
    "token": "@[Lena](6a842337-ef20-4cb9-a0ff-04fa5eb8f8d3)",
    "uuid": "6a842337-ef20-4cb9-a0ff-04fa5eb8f8d3"
  },
  "cost_ceiling_credits": 36,
  "created_at": "2026-08-02T22:32:00Z",
  "duration_ms": 8000,
  "environment_requirements": [
    "show a specific lawful public coastal viewing geometry rather than a generic luxury or empty background",
    "keep the rocket at a physically believable distance and scale for an eight-kilometer viewing position",
    "preserve coherent morning light, haze, wind, water, plume, and delayed-sound cues",
    "show no restricted site access, private credential, employment, sponsorship, accident, or explosion implication"
  ],
  "execution_authorized": false,
  "expected_output": "one identity-stable premium eight-second portrait video master",
  "generator_version": "lena_video_plan_compiler_v1",
  "governed_date": "2026-08-03",
  "property_id": "lena",
  "qa_requirements": [
    "unmistakable stable Lena identity in every assessable frame",
    "believable adult anatomy, natural hands, skin texture, and hair motion",
    "all four temporal performance beats visibly initiate, progress, complete, and recover",
    "distant rocket scale, launch trajectory, delayed sound, and public viewing geometry remain physically believable",
    "wardrobe remains exact, fully fastened, continuous, and free of reference-image leakage",
    "smartphone filming remains companion-held, natural, non-selfie, and free of impossible camera motion",
    "composition preserves Lena's face, launch context, caption-safe areas, and at least ten-percent headroom",
    "no restricted access, employment, sponsorship, endorsement, accident, explosion, or unsafe launch implication",
    "the result must look like premium finished Lena content rather than a provider demonstration"
  ],
  "resolution": "720p",
  "schema_version": "lena_video_artifact_v1",
  "sound_requirements": [
    "produce no spoken dialogue and require no voice service",
    "align breath, foot movement, clothing movement, crowd response, and distant rumble to the governed timeline",
    "make the launch rumble physically delayed and distant rather than immediate or explosive",
    "return separate auditable audio evidence before any final quality disposition"
  ],
  "upstream_artifacts": [
    {
      "artifact_id": "lena_video_2026_08_03_spacex_launch_001_character_authority_v1",
      "sha256": "192abae4ab3e48d430af93233700a2b2f7ce7866cc12e549b1ef6fc2faf1e694"
    },
    {
      "artifact_id": "lena_video_2026_08_03_spacex_launch_001_policy_v1",
      "sha256": "0bf5bbfaf12b16a665a0abb6e52b65520a8deffbe614ed036cb256c3a078b3d6"
    },
    {
      "artifact_id": "lena_video_2026_08_03_spacex_launch_001_business_intent_v1",
      "sha256": "7a69a356bd7fd7bc4a91ac8d23636ce350bf318788229377660b3eed985a5875"
    },
    {
      "artifact_id": "lena_video_2026_08_03_spacex_launch_001_spec_v1",
      "sha256": "8ae14e0d64c929db8cdd1f3c4c7e833d3617f9d26521e81df9c3bd538900d3a1"
    },
    {
      "artifact_id": "lena_video_2026_08_03_spacex_launch_001_hpe_v1",